<?xml version="1.0"?>
<!DOCTYPE _locDefinition SYSTEM "locXML.dtd">

<!-- 
	REVISION HISTORY:
-->

<_locDefinition>
<_locDefault _loc="locNone"/>

	<_locTag _loc="locData" _locAttrData="DisplayName" _locIDAttr="Name">Category</_locTag>
	<_locTag _loc="locData" _locAttrData="DisplayName, Description" _locIDAttr="Name">StringListProperty</_locTag>
	<_locTag _loc="locData" _locAttrData="DisplayName, Description" _locIDAttr="Name">StringProperty</_locTag>
	<_locTag _loc="locData" _locAttrData="DisplayName, Description" _locIDAttr="Name">EnumProperty</_locTag>
	<_locTag _loc="locData" _locAttrData="DisplayName, Description" _locIDAttr="Name">EnumValue</_locTag>
	<_locTag _loc="locData" _locAttrData="DisplayName, Description" _locIDAttr="Name">BoolProperty</_locTag>
	<_locTag _loc="locData" _locAttrData="DisplayName, Description" _locIDAttr="Name">ValueEditor</_locTag>
	<_locTag _loc="locData" _locAttrData="DisplayName, Description" _locIDAttr="Name">IntProperty</_locTag>
	<_locTag _loc="locData" _locAttrData="DisplayName, Description" _locIDAttr="Name">DynamicEnumProperty</_locTag>
	  <_locTag _loc="locData" _locAttrData="DisplayName, Description" _locIDAttr="Name">Rule</_locTag>
	  <_locTag _loc="locData" _locAttrData="Name" _locIDAttr="id">Command</_locTag>
	  <_locTag _loc="locData" _locAttrData="xml:lang" _locIDAttr="version">grammar</_locTag>
	  <_locTag _loc="locData" _locAttrData="xml:lang">CommandSet</_locTag>
	  <_locTag _loc="locData" _locAttrData="(XMLComments)">!--</_locTag>
	  <_locTag _loc="locData" >item</_locTag>
	  <_locTag _loc="locData" >Item</_locTag>
	  <_locTag _loc="locData" >Example</_locTag>
	  <_locTag _loc="locData" >ListenFor</_locTag>
	  <_locTag _loc="locData" >Feedback</_locTag>
	  <_locTag _loc="locData" >CommandPrefix</_locTag>
	  </_locDefinition>