<?xml version="1.0"?>
<!DOCTYPE _locDefinition SYSTEM "locXML.dtd">
<_locDefinition>
	<!-- To Do: uncomment following line to set elements as none-localizable by default -->
	<!-- <_locDefault _loc="locNone"/> -->
	<!-- To Do: uncomment following line to set all attributes to localizable by default -->
	<!-- <_locDefaultAttr _loc="locData"/> -->

	<!-- To Do: uncomment following line to set tag test to none-localizable 

		and its attributes size and type to localizable.
	        The _locIDAttr is optional and defines the id-attribute as the 
		resource id to use in place of a _locID attribute. 
		For eg: the value of the 'name' attribute of the 'test' tag will be 
		treated as the id for all the localizable content of the 'test' tag.
		-->
	<!-- <_locTag _loc="locNone" _locIDAttr="name" _locAttrData="size,type">test</_locTag> -->
	<_locDefault _loc="locNone"/>

	<_locTag _loc="locData" _locAttrData="label, helperText" _locIDAttr="id">group</_locTag>
	<_locTag _loc="locData" _locAttrData="label, description" _locIDAttr="id">tab</_locTag>
	<_locTag _loc="locData" _locAttrData="description, label, screentip, supertip,keytip" _locIDAttr="id">button</_locTag>
	<_locTag _loc="locData" _locAttrData="label, screentip, supertip" _locIDAttr="id">dynamicMenu</_locTag>
	<_locTag _loc="locData" _locAttrData="label, screentip, supertip" _locIDAttr="id">menu</_locTag>
	<_locTag _loc="locData" _locAttrData="label, description" _locIDAttr="id">task</_locTag>
	<_locTag _loc="locData" _locAttrData="label, description" _locIDAttr="id">taskGroup</_locTag>
	<_locTag _loc="locData" _locAttrData="label" _locIDAttr="id">dropDown</_locTag>
	<_locTag _loc="locData" _locAttrData="keytip">control</_locTag>

	<!-- To Do: uncomment following line to set tag bold to fully-localizable  -->
	<!-- <_locTag _loc="locFull">bold</_locTag> -->
</_locDefinition>

