<?xml version="1.0"?>
<!DOCTYPE _locDefinition SYSTEM "locXML.dtd">

<!-- 
	REVISION HISTORY:
-->

<_locDefinition>

	<!-- Snippets files -->
	<_locTag _loc="locNone">Assembly</_locTag>
	<_locTag _loc="locNone">Author</_locTag>
	<_locTag _loc="locNone">Code</_locTag>
	<_locTag _loc="locNone">Default</_locTag>
	<_locTag _loc="locNone">ID</_locTag>
	<_locTag _loc="locNone">Literal</_locTag>
	<_locTag _loc="locNone">Namespace</_locTag>
	<_locTag _loc="locNone">Object</_locTag>
	<_locTag _loc="locNone">Shortcut</_locTag>
	<_locTag _loc="locNone">SnippetType</_locTag>
	<_locTag _loc="locNone">Type</_locTag>
	<_locTag _loc="locNone">Version</_locTag>
	<_locTag _loc="locNone">Function</_locTag>

	<!-- Snippets Index files -->
	<_locTag _loc="locNone">DirPath</_locTag>
	<_locTag _loc="locNone">Installed</_locTag>
	<_locTag _loc="locNone">OnOff</_locTag>


</_locDefinition>