<?xml version="1.0"?>
<!DOCTYPE _locDefinition SYSTEM "locxml.dtd">
<_locDefinition>
	<!-- this is generated from optionSet -->
  <_locDefault _loc="locData" _locID="strict"></_locDefault><!--  -->
  
  <_locTag _loc="locData" _locAttrData="DIR">HTML</_locTag> <!-- ieframe.dll.mui shdocvw.dll.mui --> 
	<_locTag _loc="locFull">Text</_locTag>                    <!-- ehres.dll.mui -->
	<_locTag _loc="locData" _locAttrData="align">td</_locTag> <!-- tracerpt.exe.mui ws03res.dll.mui -->
	<_locTag _loc="locData" _locAttrData="*">title</_locTag>  <!-- bootmgr.efi.mui tracerpt.exe.mui -->
	<_locTag _loc="locFull">b</_locTag>                       <!-- tracerpt.exe.mui -->
	<_locTag _loc="locFull">img</_locTag>                     <!-- ieframe.dll.mui rssexplorerframe.dll.mui ws03res.dll.mui -->
	<_locTag _loc="locFull">ul</_locTag>                      <!-- tracerpt.exe.mui -->
	<_locTag _loc="locFull">li</_locTag>                      <!-- ptres.dll.mui -->
	<_locTag _loc="locFull">br</_locTag>                      <!-- bootmgr.efi.mui ptres.dll.mui tracerpt.exe.mui -->
	<_locTag _loc="locData" _locAttrData="xmlns">Name</_locTag> <!-- GameDefinitionFile.dll -->
	<_locTag _loc="locNone">meta</_locTag>	<!-- *.wpl  WMP playlist files --> 
	<_locTag _loc="locNone">sourceFilter</_locTag>	<!-- *.wpl  WMP playlist files --> 
	<_locTag _loc="locNone">fragment</_locTag>	<!-- *.wpl  WMP playlist files --> 
	<_locTag _loc="locNone">argument</_locTag>	<!-- *.wpl  WMP playlist files --> 
	<_locTag _loc="locNone" _locAttrData="">ConsoleFileID</_locTag>	<!-- *.msc files -->
	<_locTag _loc="locNone" _locAttrData="">Binary</_locTag>		<!-- *.msc files -->
	<_locTag _loc="locNone" _locAttrData="">GUID</_locTag>		<!-- *.msc files -->
	<_locTag _loc="locData" _locIDAttr="ID">String</_locTag>   <!-- *.msc and .plaxml files -->
    <_locTag _loc="locData" _locIDAttr="ID">String</_locTag>   <!-- *.wxl files -->
	<_locTag _loc="locData" _locIDAttr="id" _locAttrData="value">string</_locTag>   <!-- *.adml files , *.mum files also require ' _locAttrData="value" ' -->
	<_locTag _loc="locData" _locIDAttr="id">presentation</_locTag>   <!-- .adml files -->
	<_locTag _loc="locData" _locIDAttr="refId">listBox</_locTag>   <!-- .adml files -->
	<_locTag _loc="locData" _locIDAttr="refId">checkBox</_locTag>   <!-- .adml files -->
	<_locTag _loc="locData" _locIDAttr="refId">dropdownList</_locTag>   <!-- .adml files -->
	<_locTag _loc="locData" _locIDAttr="refId">decimalTextBox</_locTag>   <!-- .adml files -->
	<_locTag _loc="locData" _locIDAttr="name">Title</_locTag>   <!-- tracerpt.exe.mui -->
	<_locTag _loc="locData" _locAttrData="tip">option</_locTag>   <!-- memtest.*.mui winload.*.mui winldfw.efi.mui -->
	<_locTag _loc="locData" _locAttrData="displayName,description">update</_locTag>  <!-- *.mum files -->
	<_locTag _loc="locData" _locAttrData="displayName,description">assembly</_locTag>  <!-- *.mum files -->
	<_locTag _loc="locData" _locAttrData="PostInstallDescription,PostUninstallDescription">PostDeploymentInfo</_locTag>  <!-- *.mum files -->
	<_locTag _loc="locData" _locIDAttr="id">resource</_locTag>
	<_locTag _loc="locFull">ref</_locTag> 
	<_locTag _loc="locFull">str</_locTag> 
	<_locTag _loc="locData" _locIDAttr="id" _locAttrData="name,abbrev">day</_locTag>
	<_locTag _loc="locData" _locIDAttr="id" _locAttrData="name,abbrev">month</_locTag>
	<_locTag _loc="locData" _locAttrData="DisplayName,Description"> ServerComponent</_locTag>  <!-- *.mum files -->

  <!-- not used anymore
  <_locTag _loc="locFull" _locAttrData="">Property</_locTag>
  <_locTag _loc="locFull" _locAttrData="">ToolTip</_locTag>
  <_locTag _loc="locFull" _locAttrData="">Name</_locTag>
  <_locTag _loc="locFull" _locAttrData="">Value</_locTag>
  <_locTag _loc="locData" _locAttrData="VALUE">LANGUAGE</_locTag>
  <_locTag _loc="locData" _locAttrData="DISPLAYNAME">SKU</_locTag>
  <_locTag _loc="locData" _locAttrData="ACCESSKEY">BUTTON</_locTag>
  <_locTag _loc="locData" _locAttrData="String">Segment</_locTag>
  <_locTag _loc="locData" _locAttrData="Title,Description">NODE</_locTag>
  <_locTag _loc="locData" _locAttrData="style">tr</_locTag>
  <_locTag _loc="locData" _locAttrData="Width">Label</_locTag>
  <_locTag _loc="locData" _locAttrData="Width">Control</_locTag>
  <_locTag _loc="locData" _locAttrData="*">mys</_locTag>
  <_locTag _loc="locData" _locAttrData="title, nodata,roledescription,nodatadescription">task</_locTag>
  <_locTag _loc="locData" _locAttrData="name, tooltip">subtask</_locTag>
  <_locTag _loc="locData" _locAttrData="name,link,tooltip">tool</_locTag>
  <_locTag _loc="locData" _locAttrData="title">tooltray</_locTag>
  <_locTag _loc="locData" _locAttrData="Name,RefName">ProcessMatchingCriteria</_locTag>
  <_locTag _loc="locData" _locAttrData="Name">AllocationCriteria</_locTag>
  <_locTag _loc="locData" _locAttrData="Name">Policy</_locTag>
  <_locTag _loc="locFull" _locAttrData="">u</_locTag>
  <_locTag _loc="locFull" _locAttrData="">ol</_locTag>
  <_locTag _loc="locData" _locAttrData="GUIName">Group</_locTag>
  <_locTag _loc="locData" _locAttrData="GUIName">Component</_locTag>
  <_locTag _loc="locData" _locAttrData="description,displayName">update</_locTag>
  -->
</_locDefinition>
