<?xml version="1.0"?>
<!DOCTYPE _locDefinition SYSTEM "locXML.dtd">
<_locDefinition>
    <_locDefault _loc="locNone"/>
    <_locTag _loc="locData">title</_locTag>
    <_locTag _loc="locData">description</_locTag>
    <_locTag _loc="locData">summary</_locTag>
    <_locTag _loc="locData">id</_locTag>
    <_locTag _loc="locData">licenseUrl</_locTag>
    <_locTag _loc="locData">projectUrl</_locTag>
    <_locTag _loc="locData">language</_locTag>
    <_locTag _loc="locData">returns</_locTag>
    <_locTag _loc="locData">param</_locTag>
  </_locDefinition>