<?xml version="1.0"?>
<!DOCTYPE _locDefinition SYSTEM "locXML.dtd">
<_locDefinition>
	<!-- To Do: uncomment following line to set elements as none-localizable by default -->
	<!-- <_locDefault _loc="locNone"/> -->
	<!-- To Do: uncomment following line to set all attributes to localizable by default -->
	<!-- <_locDefaultAttr _loc="locData"/> -->

	<!-- To Do: uncomment following line to set tag test to none-localizable 
		and its attributes size and type to localizable -->
	<!-- To Do: uncomment following line to set tag bold to fully-localizable  -->
	<!-- <_locTag _loc="locFull">bold</_locTag> -->

	<!-- Start Page StartPage.xaml localization -->	
	<_locTag _loc="locData" _locIDAttr="x:Uid">sys:String</_locTag> 
	<_locTag _loc="locData" _locIDAttr="x:Uid" _locAttrData="Text">TextBlock</_locTag>
	<_locTag _loc="locData" _locIDAttr="x:Uid" _locAttrData="Content">Button</_locTag>

        <!-- Start Page Links.xml localization -->	
        <_locTag _loc="locData" _locAttrData="title" _locIDAttr="id">itemsubgroup</_locTag>
        <_locTag _loc="locData" _locIDAttr="id">title</_locTag>
        <_locTag _loc="locData" _locIDAttr="id">description</_locTag>
        <_locTag _loc="locData" _locIDAttr="id">discovertitle</_locTag>
        <_locTag _loc="locData" _locIDAttr="id">discovertext</_locTag>
        <_locTag _loc="locData" _locIDAttr="id">discovernothanks</_locTag>
        <_locTag _loc="locData" _locIDAttr="id">whatsnewtitle</_locTag>
        <_locTag _loc="locData" _locIDAttr="id">gettingstartedtitle</_locTag>

</_locDefinition>

